Слово,Употребление,Значение,Пример_1,Пример_2,Пример_3,Перевод,Синоним_1,Синоним_2,Синоним_3,Синоним_4
АБЬЮЗ,редк. разг. псих.,"Плохое, жестокое отношение к кому-л. Насилие в отношениях, в том числе психологическое, эмоциональное, вербальное, физическое и пр.","Она решила покинуть отношения, в которых испытывала постоянный абьюз со стороны партнёра.",Многие жертвы абьюза боятся обратиться за помощью из-за чувства стыда.,"Она долгое время терпела абьюз, прежде чем решилась рассказать о своих переживаниях.","(англ. abuse оскорбление, жестокое обращение).",Насилие,Оскорбление,,
АБЬЮЗЕР,редк. соц. интерн,"Человек, практикующий психологическое, физическое, вербальное или эмоциональное насилие по отношению к другому человеку. Пользователь интернета, который выходит за рамки допустимого в какой-то теме и занимается нарушением правил сообщества, например, оскорбляет всех, спамит.","Она поняла, что её партнер — настоящий абьюзер, когда начал контролировать каждое её движение.","Сообщество должно активно бороться с абьюзерами, чтобы создать безопасную атмосферу для всех участников.","Важно сообщать о действиях абьюзеров в интернете, чтобы администрация могла принять меры против них","(англ. abuser оскорбитель, насильник; нарушитель).",Насильник,Оскорбитель,,
АВАТАР,част. комп. сленг.,"Изображение на экране компьютера, находящееся вместе с именем (фамилией) пользователя.","Я выбрал аватар с изображением любимого персонажа, чтобы он отражал мою личность на форуме.","При общении в чате аватар помогает другим пользователям быстрее запомнить, с кем они разговаривают.",В онлайн-игре мой аватар стал символом нашей команды благодаря яркому дизайну и запоминающемуся имени.,(англ. avatar воплощение).,,,,
АВАТАРКА,част. комп. сленг.,"Изображение на экране компьютера, находящееся вместе с именем (фамилией) пользователя.","Я обновил свою аватарку, чтобы она лучше отражала мое настроение и стиль.","На сайте все пользователи могут выбрать уникальную аватарку, которая будет отображаться рядом с их именем в комментариях.","Моя аватарка стала популярной среди друзей, и теперь они часто просят меня рассказать о ее значении.",,,,,
АДМИН-ИНТЕРФЕЙС,интерн.,"Интерфейс, позволяющий управлять сайтом через специальную консоль (CMS - систему управления сайтом), вход на которую недоступен для всех остальных пользователей. Синоним: административный интерфейс.","Для эффективного управления локальной сетью администраторы используют админ-интерфейс, который позволяет быстро настраивать параметры подключения и безопасности.",С помощью админ-интерфейса можно легко контролировать состояние интернет-сервера и оперативно реагировать на любые сбои в его работе.,"Админ-интерфейс предоставляет доступ к инструментам для администрирования программного обеспечения на рабочих станциях, что помогает поддерживать их стабильную работоспособность.",,,,,
АЙТИШНИК,част. инф.,"Фанат компьютерных технологий или человек, разбирающийся в компьютере.","АЙТИШНИК всегда в курсе последних трендов и технологий, что позволяет ему успешно решать сложные задачи.","На конференции выступали известные АЙТИШНИКи, делясь своими знаниями и опытом с молодыми специалистами.","В нашей компании мы активно развиваем команду АЙТИШНИКов, чтобы внедрять инновационные решения в бизнес-процессы.
 Благодаря своему сенсорному экрану, АЙФОН обеспечивает интуитивно понятное управление, что делает его удобным для пользователей всех возрастов.",,,,,
БАНИТЬ,част. комп. сленг.,Запретить пользователю отправлять сообщения в форумах или чатах.,"Администрация форума решила банить пользователей, которые нарушают правила общения и оскорбляют других участников.","Если участник продолжит игнорировать предупреждения, его могут забанить на срок до месяца.",После очередного случая спама модераторы решили банить нарушителя на постоянной основе.,(англ. ban запрет).,Блокировать,Исключать,,
БАТЛ,част. сленг.,"Соперничество, конкуренция, противостояние.",В этом году на турнире пройдет настоящий батл между лучшими командами страны.,"Их батл на сцене стал настоящим зрелищем, привлекая внимание зрителей и критиков.","В социальных сетях разгорелся батл между фанатами двух популярных исполнителей, каждый из которых отстаивал своего кумира.",(англ. battle битва).,Битва,Бой,,
БАТТЛ,част. сленг.,"Соперничество, конкуренция, противостояние.",В этом году на турнире пройдет настоящий баттл между лучшими командами страны.,"Их баттл на сцене стал настоящим зрелищем, привлекая внимание зрителей и критиков.","В социальных сетях разгорелся баттл между фанатами двух популярных исполнителей, каждый из которых отстаивал своего кумира.",(англ. battle битва).,Битва,Бой,,
БИТКОЙН,част. фин. интерн.,"Виртуальная криптовалюта, торги по которой ведутся на бирже МтГокс MtGox («Mount Gox») с июля 2010 года. Пиринговая электронная платежная система, использующая биткойны.","Биткойн стал первой и наиболее известной криптовалютой, которая привлекла внимание инвесторов благодаря своим колебаниям на бирже MtGox.","Многие пользователи начали использовать биткойн как альтернативный способ оплаты в онлайн-магазинах, благодаря его пиринговой системе.","С момента своего появления биткойн изменил представление о финансах, предложив децентрализованную платформу для проведения транзакций без посредников.
 С момента своего появления биткойн изменил представление о финансах, предложив децентрализованную платформу для проведения транзакций без посредников.",(англ. bitcoin - bit единица информации «бит» + coin монета).,,,,
БЛЕФ,перен.,"Ложь, выдумка, рассчитанные на запугивание или введение кого-л. в заблуждение; хвастовство несуществующими преимуществами; «пускание пыли в глаза».","Его рассказ о том, как он выиграл миллион на ставках, оказался всего лишь блефом, чтобы произвести впечатление на друзей.","В переговорах с конкурентами он использовал блеф, надеясь запугать их и заставить принять невыгодные условия","Она поняла, что его уверения о высоких доходах были лишь блефом, призванным скрыть финансовые трудности.",(англ. bluff обман).,Обман,Хитрость,,
БЛОГ,част. интерн.,"Вебсайт, основное содержимое которого - регулярно добавляемые записи, изображения или мультимедиа.",Для блогов характерны недлинные записи временной значимости.,Совокупность всех блогов Сети принято называть блогосферой.,"Она ведет популярный блог о путешествиях, где делится своими впечатлениями и фотографиями из разных уголков мира.",(англ. blog - web log «сетевой журнал или дневник событий»).,,,,
БЛОГЕР,част. интерн.,"Создатель блога, сетевого дневника. Человек, ведущий блог.","Блогер делится своими мыслями о жизни в большом городе, вдохновляя своих читателей на новые приключения.",Молодой блогер быстро завоевал популярность благодаря своим увлекательным видео о путешествиях и кулинарии.,"Каждый день блогер публикует новые посты, в которых рассказывает о своих любимых книгах и фильмах.",(англ. blogger).,,,,
БЛОКБАСТЕР,част. общ.,"Популярные и высокодоходные произведения в литературе, и вообще в поп-культуре.","Новый роман известного автора стал настоящим блокбастером, завоевав сердца читателей по всему миру.","Фильм, основанный на бестселлере, быстро превратился в культурный блокбастер, собрав кассу в миллионы долларов.","В этом сезоне на книжных полках появилось множество новых блокбастеров, которые обещают стать настоящими хитами среди молодежи.",(англ. block-buster авиационная бомба).,,,,
БОТ,редк. комп. сленг.,"Программа, эмулирующая действия (речь) человека, иногда с зачатками искусственного интеллекта (от слова робот), предназначенная для автоматизации исполнения рутинных действий.",В последнее время многие компании начали использовать чат-ботов для автоматизации обслуживания клиентов и повышения эффективности работы.,"Новый бот, разработанный для обработки заказов, способен отвечать на вопросы пользователей и быстро решать их проблемы.","Благодаря интеграции с мессенджерами, бот стал популярным инструментом для проведения опросов и сбора обратной связи от клиентов.",(англ. bot от robot).,,,,
БРО,редк. мол. сленг.,"Брат, братан.","Я всегда могу рассчитывать на своего бро, он поддержит в любой ситуации.","Мы с моим бро провели весь уикенд, играя в видеоигры и обсуждая планы на будущее.","Когда мне было тяжело, мой бро пришел ко мне на помощь и поднял настроение.",(англ. bro сокр. от brother).,Брат,Братан,,
БУЛЛИНГ,част. соц.,"Агрессивное поведение, выражающееся в злонамеренном преследовании, жестокости, попытках оскорбления и унижения человека, подрыве его репутации и т.п.","Буллинг в школе стал серьезной проблемой, требующей внимания со стороны учителей и родителей.","Жертвы буллинга часто испытывают психологические травмы, которые могут повлиять на их самооценку и общее благополучие.","Важно создавать безопасную среду, в которой буллинг не будет оставаться безнаказанной, а жертвы смогут обратиться за помощью.",(англ. bulling – to bull задираться).,Травля,Издевательство,,
ВАЙБ,редк. общ.,"Неописуемое чувство того, что делает атмосферу особенной. Оно может быть хорошим или плохим, сумасшедшим или расслабленным. Он задает тональность в любой жизненной ситуации, особенно на вечеринках.","На этой вечеринке был такой позитивный вайб, что все сразу почувствовали себя как дома и начали веселиться.","Несмотря на дождливую погоду, в кафе царил расслабляющий вайб, который помог нам забыть о повседневных заботах.","Когда мы пришли на концерт, нас поразил сумасшедший вайб толпы, который наполнял зал энергией и радостью.","(англ. vibe энергетика атмосфера, вибрация настроение).",Атмосфера,Настроение,,
ВЕГАН,част. пищ.,"Строгий вегетарианец, обычно приверженец стрэйт эйджа, который отказывается от животной пищи по нравственной причине — нежеланию принимать опосредованное участие в гипотетическом убийстве животных.","Веган всегда тщательно выбирает продукты, чтобы убедиться, что они не содержат ни одного ингредиента животного происхождения, поддерживая свои нравственные убеждения.","На встрече единомышленников веганы делились рецептами, которые не только были вкусными, но и соответствовали их философии о защите прав животных.","Веганская диета для него стала не просто выбором пищи, а образом жизни, отражающим его стремление к более гуманному и экологически чистому существованию.
 Веганская диета для него стала не просто выбором пищи, а образом жизни, отражающим его стремление к более гуманному и экологически чистому существованию.",(англ. vegan).,,,,
ВЕЙПЕР,быт.,"Человек, «курящий» электронные сигареты.","Вейпер наслаждался ароматом клубники, выдыхая облака пара на летней веранде.","На вечеринке собрались не только любители традиционных сигарет, но и несколько вейперов, которые обсуждали новые вкусы и устройства.","Вейперы часто делятся своими впечатлениями о различных жидкостях, пытаясь найти идеальный баланс между вкусом и паром.",(англ. vaper – to vape курить электронную сигарету).,,,,
ГАДЖЕТ,част. тех.,"Портативная техническая новинка с цифровыми технологиями - карманный компьютер, сотовый телефон с добавочными функциями, авторучки с набором электронных услуг (шариковая ручка как телефон, фотокамера и т. п.), ноутбуки, часы, браслеты, электронные книги, универсальные плейеры для презентаций и т.п.","В последнее время на рынке появилось множество гаджетов, которые позволяют управлять умным домом с помощью всего лишь одного приложения на смартфоне.","Новый фитнес-гаджет отслеживает не только физическую активность, но и качество сна, предоставляя пользователю подробные отчеты о здоровье.","На выставке технологий были представлены уникальные гаджеты, такие как умные часы с функцией мониторинга сердечного ритма и встроенным GPS.",(англ. gadget приспособление).,Устройство,Прибор,Приспособление,
ГЕЙМЕР,част. разг.,"Человек, увлекающийся компьютерными играми.","Геймеры со всего мира собираются на онлайн-турниры, чтобы проверить свои навыки в популярных играх.","Мой брат — заядлый геймер, который проводит вечера, исследуя виртуальные миры и выполняя сложные квесты.","В последние годы геймеры стали настоящими звездами, получая признание и призы на международных чемпионатах по киберспорту.",(англ. gamer – to game играть в игры).,,,,
ГЕНЕРИРОВАТЬ,комп. сленг.,Создавать что-либо на компьютере.,Новая солнечная станция сможет генерировать достаточно энергии для обеспечения целого района.,"Учёные работают над тем, чтобы генерировать чистый водород из возобновляемых источников.",Эта программа позволяет пользователям генерировать уникальные пароли для повышения безопасности их аккаунтов.,"(англ. generate – to generate производить, рождать).",Создавать,,,
ГИГАБАЙТ,част. комп.,"Единица измерения памяти, состоящая из 1024 мегабайтов.",Для хранения большого объема данных на компьютере рекомендуется использовать жесткий диск объемом не менее 500 гигабайт.,"Современные смартфоны часто оснащаются оперативной памятью в 8 гигабайт, что позволяет им эффективно справляться с многозадачностью.","Мой новый ноутбук имеет 1 терабайт памяти, что эквивалентно 1024 гигабайтам, что достаточно для всех моих нужд.",(англ. gigabyte).,,,,
ГИРОСКУТЕР,част. трансп.,"Управляемое с помощью наклонов собственного тела, и заряжающееся от обычной розетки устройство для передвижения. Самоходная одноместная колесница китайского производства на электрической тяге.","Я купил гироскутер, чтобы удобно передвигаться по городу, просто наклоняясь в нужную сторону.","На выходных мы катались на гироскутерах в парке, наслаждаясь свежим воздухом и свободой передвижения.","Гироскутер стал настоящим хитом среди молодежи, так как его легко заряжать от обычной розетки и управлять с помощью собственного тела.","(англ. gyroscooter – gyro относящийся к вращению вокруг неподвижной оси + scooter самокат, мотороллер).",,,,
ГИФКА,ком.,"Картинка в формате gif(Графический файл с расширением, позволяющий хранить изображения, имеющие до 256 цветов, поддерживает прозрачность, анимацию, черезстрочную развертку и хранение в одном файле нескольких изображений.)","Я отправил другу забавную гифку с котом, который ловит лазерную указку, и она мгновенно подняла ему настроение.","На вечеринке мы обсуждали, какие гифки лучше всего подходят для выражения эмоций в чате.",В социальных сетях гифки стали популярным способом делиться смешными моментами и реакциями без необходимости писать длинные тексты.,(англ. gif сокр. от Graphic Interchange Format формат обмена графическими данными).,,,,
